{
  "retention_id": "a8e1f4b2-7bd0-4c44-9a8e-0a9c7c2c4b25",
  "spec_version": "0.4.0",
  "profile_version": "0.4.0",
  "catalog_version": "0.4.0",
  "catalog_sha256": "1ec08113e44f7c818bd9d70b20b35c52cc7284d846cff43eb179ddc26ed64e23",
  "instance_id": "b8e1f4b2-7bd0-4c44-9a8e-0a9c7c2c4b26",
  "context_id": "2a2b3c4d-1111-4aaa-8bbb-1234567890ac",
  "node_id": "Interaction.Event.Notification.Media.NowPlaying",
  "node_schema_sha256": "43109dc5336099b762f420ca5e8c3139d0bdf4d3c57ef51e858129d4389919d2",
  "policy_ref": "sia:policy:core-context:1",
  "policy_sha256": "b614a38045ea31e2abd6b82ef88b43b158b54aa30078b90bf78708cfeb798e22",
  "disposition": "coalesce",
  "state": "held",
  "retained_at_ms": 1784116800100,
  "expires_at_ms": 1784116830000,
  "valid_until_ms": 1784116830000,
  "coalescing_key_sha256": "eeeeeeeeeeeeeeeeeeeeeeeeeeeeeeeeeeeeeeeeeeeeeeeeeeeeeeeeeeeeeeee",
  "reevaluate_on": [
    "driver_state_change",
    "motion_state_change",
    "operating_mode_change"
  ],
  "policy_version": "0.4.0",
  "reason_code": "CONTEXT_COALESCED_DISTRACTED"
}
